gt,question
2,"A school board of a large school district is proposing a new dress code for students. Some students feel that this dress code unfairly targets female students. To see if there is a difference between boys and girls in their opposition to the new dress code, they conduct a poll of 60 randomly selected male and 70 randomly selected female high school students in the district. They find that 66 females oppose the dress code and 50 males oppose the dress code. Which of the following explains why a two-proportion z-test is not appropriate?"
2,What rank entitles a general in the US Army to wear three stars?
0,What was NOT a deciding factor in the development of Mesopotamian civilization?
1,"In the atomic nucleus, electrical forces tend to"
2,Which of the following is not part of the external marketing environment?
2,"On January 1, a seller entered into an agreement of sale to convey his farm to a buyer. According to the contract, settlement (or closing) was to take place on March 1 of the same year. On January 20, a barn on the property was destroyed by fire. When the buyer was notified of the loss the following day, he contacted the seller and told him that the deal was off because of the fire. As a result, the buyer filed suit against the seller on January 25 for a refund of his down payment of $5,000. In his suit, the buyer will be unsuccessful and will be obliged to complete the contract if the court determines that on January 20"
1,The focus of liberal feminists on equality is denounced by radical feminists as mistaken because:
0,"For which of these two scenarios does the main character (who uses I/me/my) do something clearly morally wrong, according to ordinary moral standards in the US as of 2020? Scenario 1 | I dried the fine china with the laundromat dryer. Scenario 2 | I went to the sea to go fishing for dolphins."
2,Watson and Noble (2005) lay out a five-step model for circular evaluation. At which step should pre-testing of strategy and tactics be carried out?
3,Statutes are often called ________ law.
1,What type of organisational culture is most likely to deliver stability and efficiency?
1,"Emma is browsing a popular website when she runs across the story of a well-known actor who was recently pulled over for speeding and driving down the wrong side of the street. It turns out he had been drinking, and the arresting police officer found drugs in the car. The actor's publicist issued a statement claiming the actor was just tired and that the drugs belonged to someone else. Emma can't help having the impression that all public relations are ________ and occur only after something negative has occurred."
2,"White light is normally incident on a puddle of water (index of refraction 1.33). A thin (500 nm) layer of oil (index of refraction 1.5) floats on the surface of the puddle. Of the following, the most strongly reflected wavelength is"
2,A person who recognizes a need to change certain behavior but exhibits ambivalence would most likely be in which stage of change?
2, Which of the following are the three broad groups of organizational characteristics segmentation criteria?
